{
  "id": "iab-half-page-300x600",
  "platform": {
    "slug": "iab",
    "name": "IAB Standard Display"
  },
  "channel": "display",
  "placement": "Half Page",
  "slug": "half-page-300x600",
  "summary": "300×600 px. Large desktop sidebar unit with room for a product and a message.",
  "creative_types": [
    "image",
    "animated-image",
    "html5"
  ],
  "dimensions": [
    {
      "width": 300,
      "height": 600,
      "label": "Standard"
    },
    {
      "width": 600,
      "height": 1200,
      "label": "2x retina, served at standard size"
    }
  ],
  "aspect_ratios": [],
  "file": {
    "formats": [
      "jpg",
      "png",
      "gif",
      "html5"
    ],
    "max_size_kb": null,
    "initial_load_kb": null,
    "subload_kb": null
  },
  "video": null,
  "safe_zone": null,
  "text_limits": [],
  "notes": [
    "Most publishers and ad servers set their own file-size caps on top of IAB guidance. Check the buy's IO."
  ],
  "sources": [
    "https://iabtechlab.com/standards/iab-new-ad-portfolio/"
  ],
  "verified_date": "2026-09-26",
  "status": "needs_review",
  "review_notes": [
    "Seed entry: dimensions are the long-standing IAB size; confirm file-size and initial-load limits from the source on Day 3.",
    "Confirm the source URL still resolves."
  ]
}
